<?xml version="1.0" encoding="UTF-8"?>
<!-- INIZIO PALINSESTO -->
<palinsesto xmlns:xs="http://www.w3.org/2001/XMLSchema-instance" xs:noNamespaceSchemaLocation="palinsesto.xsd" id="P4">  
    <!-- CARTELLONE 1 -->
	<cartellone id="C10">
		<!-- PERCORSO CARTELLONE -->
		<percorso>cartelloni/cartellone10/cartellone.html</percorso>
		<!-- LA DURATA DEVE ESSERE IN SECONDI -->
		<durata>30</durata>
		<!-- AZIENDA CHE COMMISSIONA IL CARTELLONE -->
		<azienda>Castelli's</azienda>
	</cartellone>
    <!-- FINE CARTELLONE 1 -->
    
    <!-- CARTELLONE 2 -->
	<cartellone id="C5">
		<!-- PERCORSO CARTELLONE -->
		<percorso>cartelloni/cartellone5/cartellone.html</percorso>
		<!-- LA DURATA DEVE ESSERE IN SECONDI -->
		<durata>30</durata>
		<!-- AZIENDA CHE COMMISSIONA IL CARTELLONE -->
		<azienda>Orologeria Preziosi</azienda>
	</cartellone>
    <!-- FINE CARTELLONE 2 -->
    
    <!-- CARTELLONE 3 -->
	<cartellone id="C3">
		<!-- PERCORSO CARTELLONE -->
		<percorso>cartelloni/cartellone3/cartellone.html</percorso>
		<!-- LA DURATA DEVE ESSERE IN SECONDI -->
		<durata>30</durata>
		<!-- AZIENDA CHE COMMISSIONA IL CARTELLONE -->
		<azienda>Xeeon</azienda>
	</cartellone>
    <!-- FINE CARTELLONE 3 -->

</palinsesto>
<!-- FINE PALISESTO -->
