<?xml version="1.0" encoding="UTF-8"?>
<!-- INIZIO PALINSESTO -->
<palinsesto xmlns:xs="http://www.w3.org/2001/XMLSchema-instance" xs:noNamespaceSchemaLocation="palinsesto.xsd" id="P5">  
    <!-- CARTELLONE 1 -->
	<cartellone id="C2">
		<!-- PERCORSO CARTELLONE -->
		<percorso>cartelloni/cartellone2/cartellone.html</percorso>
		<!-- LA DURATA DEVE ESSERE IN SECONDI -->
		<durata>30</durata>
		<!-- AZIENDA CHE COMMISSIONA IL CARTELLONE -->
		<azienda>Rockstar Games</azienda>
	</cartellone>
    <!-- FINE CARTELLONE 1 -->
    
    <!-- CARTELLONE 2 -->
	<cartellone id="C4">
		<!-- PERCORSO CARTELLONE -->
		<percorso>cartelloni/cartellone4/cartellone.html</percorso>
		<!-- LA DURATA DEVE ESSERE IN SECONDI -->
		<durata>30</durata>
		<!-- AZIENDA CHE COMMISSIONA IL CARTELLONE -->
		<azienda>Lavazza</azienda>
	</cartellone>
    <!-- FINE CARTELLONE 2 -->
    
    <!-- CARTELLONE 3 -->
	<cartellone id="C10">
		<!-- PERCORSO CARTELLONE -->
		<percorso>cartelloni/cartellone10/cartellone.html</percorso>
		<!-- LA DURATA DEVE ESSERE IN SECONDI -->
		<durata>30</durata>
		<!-- AZIENDA CHE COMMISSIONA IL CARTELLONE -->
		<azienda>Castelli's</azienda>
	</cartellone>
    <!-- FINE CARTELLONE 3 -->

</palinsesto>
<!-- FINE PALISESTO -->
